job_number,city,address,title,owner,contractor,engineer,receiver_email,cc_email,quality
2412,Ottawa,56 Sparks St, 56 Sparks - 7th Flr. - Doherty Office Split,Doherty,RECL,GWAL,alex.roy@dilfo.com,,
2414,Ottawa,"125 Sparks Street, Ottawa, Ontario",P07L-Library of Parliament Roof Repair,PWGSC,Pomerleau,J.L. RICHARDS,alex.roy@dilfo.com,,
2415,Ottawa,"112 Kent Street, Ottawa, Ontario",PDV Tower B - Roof Replacement,Brookfield,Ron Eastern Construction Ltd.,GWAL,alex.roy@dilfo.com,Alex@dilfo.com,2
2407,Ottawa,"11 Aviation Parkway, Ottawa, Ontario",CASM Paint Booth Supply and Install,Airport,The Ingenium,GWAL,alex.roy@dilfo.com,,2
2379,Ottawa,"40 Cassidy Road, Ottawa, Ontario, K2H 6K1",Bell High School Addition,Ottawa-Carleton District School Board (OCDSB),Laurin,GWAL,alex.roy@dilfo.com,,3
2341,Ottawa,501 Smyth Rd,TOH Stem Cell,The Ottawa Hospital,Frecon Construction,WSP,alex.roy616@me.com,,2
